SET client_min_messages TO warning;
--This is for testing functionality of timezone-specific timestamps
SET TIMEZONE TO 'America/Chicago';
--Enable all except dep tables for now
UPDATE fact_loader.fact_tables ft SET enabled = TRUE
WHERE NOT EXISTS (SELECT 1 FROM fact_loader.fact_table_deps d WHERE d.child_id = ft.fact_table_id);
--Move the mock replication stream forward to now
SELECT pglogical_ticker.tick();
 tick 
------
 
(1 row)

SELECT fact_loader.worker();
 worker 
--------
 t
(1 row)

SELECT customer_id, phone, age, last_order_id, order_product_count, order_product_promo_ids
FROM test_fact.customers_fact
ORDER BY customer_id;
 customer_id |   phone    | age | last_order_id | order_product_count | order_product_promo_ids 
-------------+------------+-----+---------------+---------------------+-------------------------
           1 | 0001234561 |  35 |             4 |                   3 | 
           2 | 0001234562 |  35 |               |                   0 | 
           3 | 0001234563 |  35 |             2 |                   2 | 
           4 | 0001234564 |  35 |               |                   0 | 
           5 | 0001234565 |  35 |             3 |                   1 | {1}
           6 | 0001234566 |  35 |               |                   0 | 
           7 | 0001234567 |  35 |               |                   0 | 
           8 | 0001234568 |  35 |               |                   0 | 
           9 | 0001234569 |  35 |               |                   0 | 
          10 | 0001234560 |  35 |               |                   0 | 
(10 rows)

--test debugging feature on this table
SET log_min_messages TO debug3;
SELECT fact_loader.worker();
 worker 
--------
 t
(1 row)

SELECT order_id, customer_id, order_date, total, is_reorder
FROM test_fact.orders_fact
ORDER BY order_id;
 order_id | customer_id | order_date |  total  | is_reorder 
----------+-------------+------------+---------+------------
        1 |           1 | 04-10-2018 |  100.00 | f
        2 |           3 | 04-11-2018 |  200.00 | f
        3 |           5 | 04-12-2018 | 2000.00 | f
        4 |           1 | 04-13-2018 |  100.00 | t
(4 rows)

RESET log_min_messages;
DO $$
BEGIN
    IF NOT (SELECT COUNT(1) FROM fact_loader.debug_process_queue) = 3 THEN
        RAISE EXCEPTION '%', 'No worky';
    END IF; 
END$$;
SELECT fact_loader.worker();
 worker 
--------
 t
(1 row)

SELECT order_id, customer_id, phone, age, max_order_date, min_total
FROM test_fact.customersorders_fact
ORDER BY order_id;
 order_id | customer_id | phone | age | max_order_date | min_total 
----------+-------------+-------+-----+----------------+-----------
(0 rows)

SELECT fact_loader.worker();
 worker 
--------
 t
(1 row)

SELECT email_id, read, promo_count
FROM test_fact.emails_fact
ORDER BY email_id;
 email_id | read | promo_count 
----------+------+-------------
        1 | t    |           1
(1 row)

SELECT fact_loader.worker();
 worker 
--------
 t
(1 row)

SELECT order_id, customer_id, order_date, total, is_reorder, num_emails, num_read
FROM test_fact.order_emails_fact
ORDER BY order_id;
 order_id | customer_id | order_date | total | is_reorder | num_emails | num_read 
----------+-------------+------------+-------+------------+------------+----------
(0 rows)

SELECT fact_loader.worker();
 worker 
--------
 t
(1 row)

SELECT customer_id, as_of_date, total_orders, last_order_date
FROM test_fact.customer_order_history_fact
ORDER BY customer_id, as_of_date;
 customer_id |       as_of_date        | total_orders | last_order_date 
-------------+-------------------------+--------------+-----------------
           1 | [04-10-2018,04-13-2018) |            1 | 04-10-2018
           1 | [04-13-2018,infinity)   |            2 | 04-13-2018
           3 | [04-11-2018,infinity)   |            1 | 04-11-2018
           5 | [04-12-2018,infinity)   |            1 | 04-12-2018
(4 rows)

UPDATE test.customers SET age = 40 WHERE customer_id = 2;
-- We need to make deletes handled with recursive joins as well first before testing this
-- DELETE FROM test.customers WHERE customer_id = 3;
/****
This should not update the fact table, because the replication stream is behind these last 2 updates
 */
SELECT fact_loader.worker();
 worker 
--------
 t
(1 row)

SELECT customer_id, phone, age, last_order_id, order_product_count, order_product_promo_ids
FROM test_fact.customers_fact
ORDER BY customer_id;
 customer_id |   phone    | age | last_order_id | order_product_count | order_product_promo_ids 
-------------+------------+-----+---------------+---------------------+-------------------------
           1 | 0001234561 |  35 |             4 |                   3 | 
           2 | 0001234562 |  35 |               |                   0 | 
           3 | 0001234563 |  35 |             2 |                   2 | 
           4 | 0001234564 |  35 |               |                   0 | 
           5 | 0001234565 |  35 |             3 |                   1 | {1}
           6 | 0001234566 |  35 |               |                   0 | 
           7 | 0001234567 |  35 |               |                   0 | 
           8 | 0001234568 |  35 |               |                   0 | 
           9 | 0001234569 |  35 |               |                   0 | 
          10 | 0001234560 |  35 |               |                   0 | 
(10 rows)

UPDATE fact_loader.fact_tables SET force_worker_priority = TRUE WHERE fact_table_relid = 'test_fact.customers_fact'::REGCLASS;
SELECT pglogical_ticker.tick();
 tick 
------
 
(1 row)

SELECT fact_loader.worker();
 worker 
--------
 t
(1 row)

SELECT customer_id, phone, age, last_order_id, order_product_count, order_product_promo_ids
FROM test_fact.customers_fact
ORDER BY customer_id;
 customer_id |   phone    | age | last_order_id | order_product_count | order_product_promo_ids 
-------------+------------+-----+---------------+---------------------+-------------------------
           1 | 0001234561 |  35 |             4 |                   3 | 
           2 | 0001234562 |  40 |               |                   0 | 
           3 | 0001234563 |  35 |             2 |                   2 | 
           4 | 0001234564 |  35 |               |                   0 | 
           5 | 0001234565 |  35 |             3 |                   1 | {1}
           6 | 0001234566 |  35 |               |                   0 | 
           7 | 0001234567 |  35 |               |                   0 | 
           8 | 0001234568 |  35 |               |                   0 | 
           9 | 0001234569 |  35 |               |                   0 | 
          10 | 0001234560 |  35 |               |                   0 | 
(10 rows)

--This would simulate an application's changes being out of order now
UPDATE test.customers SET age = 41 WHERE customer_id = 2;
SELECT pglogical_ticker.tick();
 tick 
------
 
(1 row)

SELECT fact_loader.worker();
 worker 
--------
 t
(1 row)

--Pretend the transaction for this began before the update above - by lowering the actual audit_id and tx time
UPDATE test.customers SET age = 42 WHERE customer_id = 2;
UPDATE test_audit_raw.customers_audit
SET customers_audit_id = customers_audit_id - 1000, changed_at = changed_at - interval '1 minute'
WHERE customers_audit_id = (SELECT MAX(customers_audit_id) FROM test_audit_raw.customers_audit);
--However, we assume fact_loader_batch_id is still in order because we have a single-threaded
--predicatable order with pglogical or a local queue table fed by pg_fact_loader 
--This will be missed by version 1.2, but not 1.3
SELECT pglogical_ticker.tick();
 tick 
------
 
(1 row)

SELECT fact_loader.worker();
 worker 
--------
 t
(1 row)

SELECT (age = 42) AS age_is_updated
FROM test_fact.customers_fact
WHERE customer_id = 2
ORDER BY customer_id;
 age_is_updated 
----------------
 t
(1 row)

ALTER EXTENSION pg_fact_loader UPDATE;
UPDATE fact_loader.fact_tables SET force_worker_priority = FALSE WHERE fact_table_relid = 'test_fact.customers_fact'::REGCLASS;
